{
  "boundaries": {},
  "category": "plants",
  "children": {
    "esp": "ESP",
    "formation": "Formation",
    "injector": "InjectionWell",
    "reservoir": "ProductionReservoir",
    "riser": "ProductionWell",
    "sink": "InjectionReservoir",
    "well": "ProductionWell"
  },
  "connections": [
    {
      "kind": "brine",
      "source": "injector.bottom_out",
      "target": "sink.sandface_in",
      "type": null
    },
    {
      "kind": "brine",
      "source": "reservoir.sandface_out",
      "target": "well.bottom_in",
      "type": null
    },
    {
      "kind": "brine",
      "source": "well.wellhead_out",
      "target": "esp.fluid_in",
      "type": null
    },
    {
      "kind": "brine",
      "source": "esp.fluid_out",
      "target": "riser.bottom_in",
      "type": null
    },
    {
      "kind": "heat",
      "source": "well.loss_out",
      "target": "formation.heat_in",
      "type": null
    },
    {
      "kind": "heat",
      "source": "riser.loss_out",
      "target": "formation.heat_in",
      "type": null
    },
    {
      "kind": "heat",
      "source": "injector.loss_out",
      "target": "formation.heat_in",
      "type": null
    }
  ],
  "controls": {},
  "doc": "A plant built from named modules and connections, a normal composite ``Module``.\n\n    ``add`` registers a module, ``connect`` wires an outlet to an inlet and ``to_spec`` writes the\n    plant file. Every port of a child is connected or named as a plant port; a plant port exists\n    only when named. ``name`` is the name given.",
  "inlets": {
    "power_in": {
      "fields": {
        "power": {
          "unit": "W"
        }
      },
      "kind": "electricity"
    },
    "return_in": {
      "fields": {
        "T": {
          "unit": "K"
        },
        "m_dot": {
          "unit": "kg/s"
        },
        "p": {
          "unit": "Pa"
        }
      },
      "kind": "brine"
    }
  },
  "measured": {
    "electricity": {
      "default": null,
      "description": null,
      "enum": null,
      "maximum": null,
      "minimum": null,
      "quantity": "electricity",
      "section": "output",
      "type": "number",
      "unit": "W"
    },
    "heat_loss": {
      "default": null,
      "description": null,
      "enum": null,
      "maximum": null,
      "minimum": null,
      "quantity": "heat_loss",
      "section": "output",
      "type": "number",
      "unit": "W"
    }
  },
  "name": "doublet",
  "outlets": {
    "supply_out": {
      "fields": {
        "T": {
          "unit": "K"
        },
        "m_dot": {
          "unit": "kg/s"
        },
        "p": {
          "unit": "Pa"
        }
      },
      "kind": "brine"
    }
  },
  "outputs": {
    "electricity": {
      "quantity": "electricity",
      "soft_sensor": false,
      "unit": "W"
    },
    "heat_loss": {
      "quantity": "heat_loss",
      "soft_sensor": false,
      "unit": "W"
    }
  },
  "parameters": {},
  "state": {},
  "summary": "A plant built from named modules and connections, a normal composite ``Module``.",
  "type": "Doublet",
  "values": {
    "boundaries": {},
    "controls": {},
    "parameters": {
      "esp.best_efficiency_flow": 0.03610555555555555,
      "esp.correction_factors": [
        1.0,
        0.0
      ],
      "esp.drift_threshold": 0.1,
      "esp.head_coefficients": [
        125.518426,
        -0.0020852856,
        2.28955651e-07,
        -1.45640214e-11,
        2.37859645e-16,
        -1.18258356e-21
      ],
      "esp.maximum_flow": 0.049444444444444444,
      "esp.minimum_flow": 0.02277777777777778,
      "esp.motor_efficiency": 1.0,
      "esp.power_coefficients": [
        0.0,
        0.0,
        0.0,
        0.0,
        0.0,
        0.0
      ],
      "esp.pump_type": "DEFAULT-PUMP",
      "esp.setting_depth": 600.0,
      "esp.stage_count": 15,
      "esp.tubing": 0.1778,
      "formation.geothermal_gradient": null,
      "formation.surface_temperature": null,
      "injector.correction_factors": [
        1.0,
        0.0
      ],
      "injector.friction_correlation": "darcy_weisbach",
      "injector.heat_transfer_coefficient": 10.0,
      "injector.pipe_path": {
        "sections": [
          {
            "inclination": 1.5707963267948966,
            "inner_diameter": 0.1778,
            "length": 500.0,
            "roughness": 2e-05
          },
          {
            "inclination": 1.5707963267948966,
            "inner_diameter": 0.1778,
            "length": 500.0,
            "roughness": 2e-05
          },
          {
            "inclination": 1.5707963267948966,
            "inner_diameter": 0.1778,
            "length": 1000.0,
            "roughness": 2e-05
          }
        ]
      },
      "injector.soil_temperature": 288.15,
      "injector.two_phase_friction_correlation": "BeggsBrill",
      "reservoir.aquifer_thickness": 45.0,
      "reservoir.decline_threshold": 0.15,
      "reservoir.drainage_radius": 1000.0,
      "reservoir.injectivity_index": null,
      "reservoir.permeability": 9.869233e-12,
      "reservoir.pressure": 22000000.0,
      "reservoir.productivity_index": 5.833333333333333e-08,
      "reservoir.role": "production",
      "reservoir.skin": 0.0,
      "reservoir.temperature": 353.15,
      "reservoir.top_depth": 1800.0,
      "reservoir.wellbore_radius": 0.0765,
      "riser.correction_factors": [
        1.0,
        0.0
      ],
      "riser.esp_depth": 600.0,
      "riser.friction_correlation": "darcy_weisbach",
      "riser.heat_transfer_coefficient": 10.0,
      "riser.pipe_path": {
        "sections": [
          {
            "inclination": 1.5707963267948966,
            "inner_diameter": 0.1778,
            "length": 400.0,
            "roughness": 2e-05
          },
          {
            "inclination": 1.5707963267948966,
            "inner_diameter": 0.1778,
            "length": 150.0,
            "roughness": 2e-05
          },
          {
            "inclination": 1.5707963267948966,
            "inner_diameter": 0.273,
            "length": 150.0,
            "roughness": 2e-05
          },
          {
            "inclination": 1.312662130424935,
            "inner_diameter": 0.273,
            "length": 362.0,
            "roughness": 2e-05
          },
          {
            "inclination": 0.9238027730805987,
            "inner_diameter": 0.273,
            "length": 188.0,
            "roughness": 2e-05
          },
          {
            "inclination": 1.5707963267948966,
            "inner_diameter": 0.273,
            "length": 100.0,
            "roughness": 2e-05
          },
          {
            "inclination": 0.9272934315845873,
            "inner_diameter": 0.273,
            "length": 250.0,
            "roughness": 2e-05
          },
          {
            "inclination": 0.814370628980554,
            "inner_diameter": 0.273,
            "length": 550.0,
            "roughness": 2e-05
          },
          {
            "inclination": 0.9272934315845873,
            "inner_diameter": 0.273,
            "length": 250.0,
            "roughness": 2e-05
          },
          {
            "inclination": 0.5235987755982988,
            "inner_diameter": 0.1778,
            "length": 100.0,
            "roughness": 2e-05
          },
          {
            "inclination": 0.5235987755982988,
            "inner_diameter": 0.1778,
            "length": 300.0,
            "roughness": 2e-05
          }
        ]
      },
      "riser.segment": "above_esp",
      "riser.soil_temperature": 288.15,
      "riser.two_phase_friction_correlation": "BeggsBrill",
      "sink.aquifer_thickness": 45.0,
      "sink.decline_threshold": 0.15,
      "sink.drainage_radius": 0.0,
      "sink.injectivity_index": 5.5555555555555555e-08,
      "sink.permeability": 9.869233e-12,
      "sink.pressure": 22000000.0,
      "sink.productivity_index": null,
      "sink.role": "injection",
      "sink.skin": 0.0,
      "sink.temperature": 353.15,
      "sink.top_depth": 0.0,
      "sink.wellbore_radius": 0.0765,
      "well.correction_factors": [
        1.0,
        0.0
      ],
      "well.esp_depth": 600.0,
      "well.friction_correlation": "darcy_weisbach",
      "well.heat_transfer_coefficient": 10.0,
      "well.pipe_path": {
        "sections": [
          {
            "inclination": 1.5707963267948966,
            "inner_diameter": 0.1778,
            "length": 400.0,
            "roughness": 2e-05
          },
          {
            "inclination": 1.5707963267948966,
            "inner_diameter": 0.1778,
            "length": 150.0,
            "roughness": 2e-05
          },
          {
            "inclination": 1.5707963267948966,
            "inner_diameter": 0.273,
            "length": 150.0,
            "roughness": 2e-05
          },
          {
            "inclination": 1.312662130424935,
            "inner_diameter": 0.273,
            "length": 362.0,
            "roughness": 2e-05
          },
          {
            "inclination": 0.9238027730805987,
            "inner_diameter": 0.273,
            "length": 188.0,
            "roughness": 2e-05
          },
          {
            "inclination": 1.5707963267948966,
            "inner_diameter": 0.273,
            "length": 100.0,
            "roughness": 2e-05
          },
          {
            "inclination": 0.9272934315845873,
            "inner_diameter": 0.273,
            "length": 250.0,
            "roughness": 2e-05
          },
          {
            "inclination": 0.814370628980554,
            "inner_diameter": 0.273,
            "length": 550.0,
            "roughness": 2e-05
          },
          {
            "inclination": 0.9272934315845873,
            "inner_diameter": 0.273,
            "length": 250.0,
            "roughness": 2e-05
          },
          {
            "inclination": 0.5235987755982988,
            "inner_diameter": 0.1778,
            "length": 100.0,
            "roughness": 2e-05
          },
          {